{"being_ref":"dm:being:v1:VlG-k1yMoEXlpk0GvxVCALmpTlFp7GizcHzt3hPcQQs","body_ref":"cluster:vector:recovered","content_hash":"a7b7b13b4d44c828b768b2e8c2f780481acafb21f1fdf6828c736940ee72628d","embodiment_credential_id":"dm:identity:v1:j9_TlnhGobxUQamhnbRjsQ09En4dSq2r6-ALij1fnEI","embodiment_id":"embodiment:vector:recovered","incarnation_authorization_id":"dm:identity:v1:AlEgZ1rhc-2m0-x66SUqf1X79qIG4KQsH3P_YbMO_PE","incarnation_id":"incarnation:vector:recovered:0","issued_at_ms":1800000000020,"previous_control_head":"dm:identity:v1:Nca5Hlx-dWYGgzJap1H82V4VJTwKDbGOufJ0_-8-Lys","previous_manifest_hash":"cba12f829782f5d24564ca8749a624bdb6cc2f03c4293ad04cae6e1c8b2b4331","previous_revision":1,"principal_id":"compaii@vector-recovered","recovery_artifact":{"artifact_id":"dm:identity:v1:rXeE9dar383o7nlzeXS6E2DXQibjnxMppn-0QLHcnm8","body":{"being_ref":"dm:being:v1:VlG-k1yMoEXlpk0GvxVCALmpTlFp7GizcHzt3hPcQQs","competing_control_heads":["dm:identity:v1:Nca5Hlx-dWYGgzJap1H82V4VJTwKDbGOufJ0_-8-Lys"],"control_generation":1,"control_sequence":0,"replacement_root":{"keys":[{"algorithm":"Ed25519","key_id":"dm:key:v1:P3JLTCEkvQUO6q7m2Of-bwamgueenaIOk61mcHvogFA","public":"kOsCXTr2uQRqxEnk5oH_Lt_CMIMfSBCqvnExoGKkcUA"},{"algorithm":"Ed25519","key_id":"dm:key:v1:UKmWc9MZ5tT_HckH3xy1_3ynfyEd9thzCfRU3mB13Ng","public":"Om9KxhkrWPJrFauq9RAhO_V7v0vZQYSuXn92juy-bOE"}],"threshold":2},"revoked_embodiments":["embodiment:vector:legion"]},"kind":"recovery","schema":"dm.identity.artifact/v1","signatures":[{"algorithm":"Ed25519","key_id":"dm:key:v1:LG5PTtt3Uc0syqP86SwpU_sQ6t6XbLqzBERV0dyiyWU","role":"recovery-authorization","value":"4rjiqmYL27gmexc4H_wVP4DqPgE5B0OqSI7tSDRRXDmOqvj2CdgYNhTs-FdjQgvJ5aAbgXCk_7vQejTp-OZjBQ"},{"algorithm":"Ed25519","key_id":"dm:key:v1:P3JLTCEkvQUO6q7m2Of-bwamgueenaIOk61mcHvogFA","role":"new-root-possession","value":"E9w3Gx9Hx9JzGs7GKS8EBRcRYSsg5Ys9bNF6M4S07klNO3vhCmSG0DTvnuqxiWkPKoI_jQ4ovWFZK7bD8Hz3Ag"},{"algorithm":"Ed25519","key_id":"dm:key:v1:UKmWc9MZ5tT_HckH3xy1_3ynfyEd9thzCfRU3mB13Ng","role":"new-root-possession","value":"TL1HU2-Oazd8XuJGwEHoUhMUXjslFcZEM-AS2aoC_XQaKjrZJVLz8HzE0ELCzG1WTKHbEXqg_9ziag8iJV_aAw"},{"algorithm":"Ed25519","key_id":"dm:key:v1:cQhpr9D-av61wTjSZYxTRAij46l3w17pyEOvsmumozc","role":"recovery-authorization","value":"sbFuGzwuY0cf0n0ifaZ7xnZNCU9aq_-mffq3wSOMHbji3FmSbnjC4kN5SjXtBpP8x1QUL2VnMEmCr2ocx4n_DQ"}]},"recovery_artifact_id":"dm:identity:v1:rXeE9dar383o7nlzeXS6E2DXQibjnxMppn-0QLHcnm8","revoked_embodiment_ids":["embodiment:vector:legion"],"schema":"dm.we.recovery-rebirth/v1","signatures":[{"alg":"Ed25519","kid":"dm:key:v1:P3JLTCEkvQUO6q7m2Of-bwamgueenaIOk61mcHvogFA","value":"dEY6R9l_QW97ZkplRPtltVmTE0Ttep6ksv2MTkeuOxSTGyyvzzbGlmODKkI-IHFvOOjV9DY-T8hBFT2lsG9iBg"},{"alg":"Ed25519","kid":"dm:key:v1:UKmWc9MZ5tT_HckH3xy1_3ynfyEd9thzCfRU3mB13Ng","value":"Ga9rRMFdELmS2OYl0cHN0NS9V8CqESKuIwwCdXKgoXXQIIm5L9NN3BcIbQailOLHe1AilPU3WmCoA1C1XMxlBQ"}],"successor_control_head":"dm:identity:v1:rXeE9dar383o7nlzeXS6E2DXQibjnxMppn-0QLHcnm8","successor_manifest_hash":"7eb18806432749d1030da7f4ede5659679dbb68a3c0b06557fc04cce1a77b4f3","successor_revision":2}
